id,text
1,"O mercado de ações subiu hoje devido ao aumento na confiança dos investidores."
2,"A inteligência artificial está revolucionando o setor de tecnologia."
3,"O futebol é um esporte amado por milhões de pessoas em todo o mundo."
4,"Novas técnicas de agricultura sustentável estão sendo desenvolvidas para preservar o meio ambiente."
5,"Filmes de ficção científica frequentemente exploram temas sobre o futuro da humanidade."
6,"Receitas caseiras são uma ótima maneira de economizar e se alimentar de forma saudável."
7,"A importância da educação financeira cresce em um mundo cada vez mais digital."
8,"Descobertas no espaço profundo estão ampliando nosso entendimento sobre o universo."
9,"Jogos eletrônicos se tornaram uma indústria bilionária, atraindo públicos de todas as idades."
10,"A prática de meditação está ganhando popularidade como forma de reduzir o estresse."
